{
  "format": "robotab/1.0",
  "generated_utc": "2026-09-15T16:24:19+00:00",
  "source": {
    "file": "",
    "duration_s": 4.84,
    "sample_rate": 22050,
    "mode": "monophonic"
  },
  "instrument": {
    "type": "guitar",
    "tuning": "standard",
    "open_midi": [
      40,
      45,
      50,
      55,
      59,
      64
    ],
    "string_index": "0 = lowest pitched string",
    "max_fret": 15,
    "capo": 0
  },
  "timing": {
    "tempo_bpm": 95.7,
    "time_signature": "4/4",
    "quantized_subdivision": 16,
    "beat_times": [
      0.1045,
      0.8011,
      1.4977,
      2.1246,
      2.7748,
      3.4017,
      3.9938
    ],
    "clock": "seconds from start of take"
  },
  "robot": {
    "press_lead_s": 0.06,
    "release_lag_s": 0.015,
    "strum_stagger_s": 0.018,
    "arms": [
      "fret",
      "pick"
    ]
  },
  "stats": {
    "groups": 5,
    "notes": 5,
    "chords": 0,
    "open_strings": 2,
    "max_fret": 3,
    "mean_fret": 1.0,
    "hand_shifts": 1,
    "total_shift_frets": 2,
    "barres": 0
  },
  "notes": [
    {
      "id": "n0000s1",
      "group": 0,
      "onset_s": 1.45415,
      "duration_s": 0.43537,
      "beat": 1.9375,
      "measure": 0,
      "midi": 45,
      "pitch": "A2",
      "freq_hz": 110.0,
      "string": 1,
      "string_label": "5",
      "fret": 0,
      "finger": 0,
      "open": true,
      "velocity": 0.96,
      "confidence": 0.514,
      "strum_direction": null,
      "pick_direction": "down",
      "hand_position": 0,
      "barre": null
    },
    {
      "id": "n0001s2",
      "group": 1,
      "onset_s": 1.88952,
      "duration_s": 0.27574,
      "beat": 2.625,
      "measure": 0,
      "midi": 51,
      "pitch": "D#3",
      "freq_hz": 155.563,
      "string": 2,
      "string_label": "4",
      "fret": 1,
      "finger": 1,
      "open": false,
      "velocity": 0.765,
      "confidence": 0.55,
      "strum_direction": null,
      "pick_direction": "up",
      "hand_position": 1,
      "barre": null
    },
    {
      "id": "n0002s1",
      "group": 2,
      "onset_s": 2.16526,
      "duration_s": 0.52825,
      "beat": 3.0625,
      "measure": 0,
      "midi": 45,
      "pitch": "A2",
      "freq_hz": 110.0,
      "string": 1,
      "string_label": "5",
      "fret": 0,
      "finger": 0,
      "open": true,
      "velocity": 0.765,
      "confidence": 0.489,
      "strum_direction": null,
      "pick_direction": "down",
      "hand_position": 0,
      "barre": null
    },
    {
      "id": "n0003s1",
      "group": 3,
      "onset_s": 2.73415,
      "duration_s": 1.11166,
      "beat": 3.9375,
      "measure": 0,
      "midi": 48,
      "pitch": "C3",
      "freq_hz": 130.813,
      "string": 1,
      "string_label": "5",
      "fret": 3,
      "finger": 1,
      "open": false,
      "velocity": 1.0,
      "confidence": 0.478,
      "strum_direction": null,
      "pick_direction": "up",
      "hand_position": 3,
      "barre": null
    },
    {
      "id": "n0004s2",
      "group": 4,
      "onset_s": 3.95683,
      "duration_s": 0.39619,
      "beat": 5.9375,
      "measure": 1,
      "midi": 51,
      "pitch": "D#3",
      "freq_hz": 155.563,
      "string": 2,
      "string_label": "4",
      "fret": 1,
      "finger": 1,
      "open": false,
      "velocity": 0.546,
      "confidence": 1.0,
      "strum_direction": null,
      "pick_direction": "down",
      "hand_position": 1,
      "barre": null
    }
  ],
  "commands": [
    {
      "t": 1.45415,
      "arm": "pick",
      "action": "pluck",
      "string": 1,
      "direction": "down",
      "velocity": 0.96,
      "note_id": "n0000s1",
      "seq": 0
    },
    {
      "t": 1.82952,
      "arm": "fret",
      "action": "press",
      "string": 2,
      "fret": 1,
      "finger": 1,
      "note_id": "n0001s2",
      "barre": null,
      "seq": 1
    },
    {
      "t": 1.82952,
      "arm": "fret",
      "action": "move",
      "position": 1,
      "from_position": null,
      "travel_s": 0.0,
      "feasible": true,
      "pre_take": true,
      "seq": 2
    },
    {
      "t": 1.88952,
      "arm": "pick",
      "action": "pluck",
      "string": 2,
      "direction": "up",
      "velocity": 0.765,
      "note_id": "n0001s2",
      "seq": 3
    },
    {
      "t": 2.16526,
      "arm": "pick",
      "action": "pluck",
      "string": 1,
      "direction": "down",
      "velocity": 0.765,
      "note_id": "n0002s1",
      "seq": 4
    },
    {
      "t": 2.18026,
      "arm": "fret",
      "action": "release",
      "string": 2,
      "fret": 1,
      "finger": 1,
      "note_id": "n0001s2",
      "seq": 5
    },
    {
      "t": 2.62971,
      "arm": "fret",
      "action": "move",
      "position": 3,
      "from_position": 1,
      "travel_s": 0.04444,
      "feasible": true,
      "pre_take": false,
      "seq": 6
    },
    {
      "t": 2.67415,
      "arm": "fret",
      "action": "press",
      "string": 1,
      "fret": 3,
      "finger": 1,
      "note_id": "n0003s1",
      "barre": null,
      "seq": 7
    },
    {
      "t": 2.73415,
      "arm": "pick",
      "action": "pluck",
      "string": 1,
      "direction": "up",
      "velocity": 1.0,
      "note_id": "n0003s1",
      "seq": 8
    },
    {
      "t": 3.85238,
      "arm": "fret",
      "action": "move",
      "position": 1,
      "from_position": 3,
      "travel_s": 0.04444,
      "feasible": true,
      "pre_take": false,
      "seq": 9
    },
    {
      "t": 3.86081,
      "arm": "fret",
      "action": "release",
      "string": 1,
      "fret": 3,
      "finger": 1,
      "note_id": "n0003s1",
      "seq": 10
    },
    {
      "t": 3.89683,
      "arm": "fret",
      "action": "press",
      "string": 2,
      "fret": 1,
      "finger": 1,
      "note_id": "n0004s2",
      "barre": null,
      "seq": 11
    },
    {
      "t": 3.95683,
      "arm": "pick",
      "action": "pluck",
      "string": 2,
      "direction": "down",
      "velocity": 0.546,
      "note_id": "n0004s2",
      "seq": 12
    },
    {
      "t": 4.36802,
      "arm": "fret",
      "action": "release",
      "string": 2,
      "fret": 1,
      "finger": 1,
      "note_id": "n0004s2",
      "seq": 13
    },
    {
      "t": 4.60302,
      "arm": "fret",
      "action": "release_all",
      "seq": 14
    },
    {
      "t": 4.60302,
      "arm": "pick",
      "action": "rest",
      "seq": 15
    }
  ],
  "warnings": [],
  "tab": "E ||--------|--|\nB ||--------|--|\nG ||--------|--|\nD ||--1-----|1-|\nA ||0---0-3-|--|\nE ||--------|--|"
}